{
  "content": "I'm trying to save money.",
  "language": "eng",
  "translations": [
    "ita:Sto provando a risparmiare dei soldi",
    "ita:Sto provando a risparmiare del denaro"
  ],
  "tags": [
    "eng:tatoeba-sentence"
  ],
  "credits": [
    "Sentence from Tatoeba by CK (CC-BY 2.0 FR)"
  ]
}
