{
  "content": "parada",
  "language": "spa",
  "tags": [
    "eng:tatoeba-sentence-part"
  ],
  "usage_examples": [
    "spa:¿Dónde está la parada de colectivos más cercana﹖"
  ],
  "translations": [
    "eng:stop",
    "eng:halt",
    "eng:station",
    "eng:break"
  ],
  "logs": {
    "2026-01-22T15:44:14.267100Z": "TRANSLATION_DONE:eng"
  }
}
