{
  "content": "Out of a hundred soldiers, ten returned unharmed, the rest died.",
  "language": "eng",
  "translations": [
    "ita:Dei cento soldati dieci ritornarono incolumi, gli altri sono morti"
  ],
  "tags": [
    "eng:tatoeba-sentence"
  ],
  "credits": [
    "Sentence from Tatoeba by bluepie88 (CC-BY 2.0 FR)"
  ]
}
