{
  "content": "Beyond what number of Facebook friends are you considered to have a dissociative identity disorder?",
  "language": "eng",
  "translations": [
    "ita:Oltre quale numero di amici di Facebook si è considerati di avere un disturbo dissociativo d'identità﹖"
  ],
  "tags": [
    "eng:tatoeba-sentence"
  ],
  "credits": [
    "Sentence from Tatoeba by sacredceltic (CC-BY 2.0 FR)"
  ]
}
