{
  "content": "If work permits, I would like to go see you guys in April.",
  "language": "eng",
  "translations": [
    "ita:Se il lavoro lo permette, vorrei andare a trovare voi ragazzi ad aprile"
  ],
  "tags": [
    "eng:tatoeba-sentence"
  ],
  "credits": [
    "Sentence from Tatoeba by unknown (CC-BY 2.0 FR)"
  ]
}
