{
  "content": "Tom said he'll be leaving tomorrow.",
  "language": "eng",
  "translations": [
    "ita:Tom ha detto che partirà domani",
    "ita:Tom ha detto che se ne andrà domani"
  ],
  "tags": [
    "eng:tatoeba-sentence"
  ],
  "credits": [
    "Sentence from Tatoeba by CK (CC-BY 2.0 FR)"
  ]
}
