{
  "content": "Think, everyone! Where haven't we yet looked for Tom?",
  "language": "eng",
  "translations": [
    "ita:Pensate, tutti! Dove non abbiamo ancora cercato Tomï¹–"
  ],
  "tags": [
    "eng:tatoeba-sentence"
  ],
  "credits": [
    "Sentence from Tatoeba by sundown (CC-BY 2.0 FR)"
  ]
}
