{
  "content": "How many sisters do you have?",
  "language": "eng",
  "translations": [
    "ita:Quante sorelle avete﹖",
    "ita:Quante sorelle hai﹖",
    "ita:Quante sorelle ha﹖"
  ],
  "tags": [
    "eng:tatoeba-sentence"
  ],
  "credits": [
    "Sentence from Tatoeba by CK (CC-BY 2.0 FR)"
  ]
}
