{
  "content": "decirle",
  "language": "spa",
  "tags": [
    "eng:tatoeba-sentence-part"
  ],
  "usage_examples": [
    "spa:Pretendo decirle a Tom que no quiero ir"
  ],
  "translations": [
    "eng:to tell himher",
    "eng:to say to himher"
  ],
  "logs": {
    "2026-01-22T15:43:24.194691Z": "TRANSLATION_DONE:eng"
  }
}
