{
  "content": "بِتحِبّ مَايُونَيز عَلى اِلسَندَويتش بِتاَعَك؟",
  "language": "arz",
  "translations": [
    "eng:would you like some mayonnaise on your sandwich"
  ],
  "transcriptions": {
    "arabizi": "bithibbamayoonayz Aala ilsandaweetshabitaeA|ak?"
  },
  "tags": [
    "eng:lisaanmasry-sentence"
  ],
  "credits": [
    "Data from [lisaanmasry](https://eu.lisaanmasry.org/info/en/copyright.html); This material is Copyright © 2007-2020 Mike Green."
  ],
  "parts": [
    "arz:بِتحِبّ",
    "arz:عَلى",
    "arz:اِلسَندَويتش",
    "arz:َك؟"
  ],
  "logs": {}
}