{
  "content": "fit",
  "language": "eng",
  "translations": [
    "arz:مَظْبُوطَة",
    "arz:مَظبوط",
    "tur:hale"
  ],
  "tags": [
    "eng:lisaanmasry-word-translation"
  ],
  "credits": [
    "Data from [lisaanmasry](https://eu.lisaanmasry.org/info/en/copyright.html); This material is Copyright © 2007-2020 Mike Green."
  ],
  "logs": {}
}
