{
  "content": "He says he's busy today.",
  "language": "eng",
  "translations": [
    "ita:Dice che di essere occupato oggi",
    "ita:Dice che è impegnato oggi",
    "ita:Dice che è occupato oggi",
    "ita:Dice di essere impegnato oggi"
  ],
  "tags": [
    "eng:tatoeba-sentence"
  ],
  "credits": [
    "Sentence from Tatoeba by CH (CC-BY 2.0 FR)"
  ]
}
